地名id,地名,繁体地名,别名,地名类别,景观类型,地理位置,朝代,时期,经度,纬度,相关作品,相关人物,相关地点,相关事件,地名描述
2133,杨将军巷,楊將軍巷,,道路,人物姓氏,依据《陆师学堂新测金陵省全图》，补充1874年《上江两县志》、1908年《金陵杂志》定位,清朝,清朝,118.7877,32.0491,,,,,明朝杨凌将军居此，故名杨将军巷
2961,水西门外大街,水西門外大街,,道路,城市与建筑,依据《1930年代南京市实测新图》定位,近代,近代,118.7596,32.0332,,,,,"近代，水西门外大街曾
《金陵纪事》：每逢夜战，贼在城隅只点一灯极明亮，又用人在城上擂大鼓、打锣鼓以助军威。有夜战则更鼓尤众盛，平时将神香遍收，每晚在城琛洞内焚烧，烟雾迷离，伪若守城人众，其实城上并无多人。六月大东风半月余，炮架倾倒，屋以板隔在城上者皆吹倒于城上，城中屋瓦皆飞，惜此时并无攻城者。当时城中并无埋伏，厥后恐因怯者之言转致伊心立机设伏，且停留长其智慧，凡事皆然。过水西门外大街，见有大将军炮约重五千觔者两尊，月城内约重二三千觔者四五尊，想各门不过如此有兵攻城，亦带往在各城呼喝喧嚣，明是虚者实之，因城空，伪为多人之意。——《南京城墙志》"
1775,大辉复巷,大輝複巷,,道路,愿景,南起安品街，北至今小常巷,清朝,清朝,118.7713,32.0308,,,,,大辉复巷南起安品街，北至今小常巷。陈作霖《运渎桥道小志》载，（安品街）“道北委巷纵横，其近甓门者，曰辉复巷。（北通七家湾。）自巷东出，又有小辉复巷。（东通驴皮巷。）予宅后户所在也。”明代，这里聚集大量回回户和回民服务机构，附近人称此巷为“回回巷”。又因南京白话“回”“辉”不分，后演变称为“辉复巷”。——百度百科
2005,双塘巷,雙塘巷,,道路,山川,依据《陆师学堂新测金陵省全图》，补充1874年《上江两县志》、1908年《金陵杂志》定位,清朝,清朝,118.7857,32.0402,,,,,
1374,厚载门,厚載門,,城门,愿景,依据《陆师学堂新测金陵省全图》，补充1874年《上江两县志》、1908年《金陵杂志》定位,清朝,清朝,118.8134,32.0487,,,北安门,,"《钟南淮北区域志》云，在厚载门后有香林寺，明时所建，流传至清，梁庆云寺佛牙流传在此。
另据《钟南淮北区域志》云：“西北有香林寺，在厚载门后，明时所建。梁庆云寺佛牙流传在此；又有大藤，结成自然椅，容坐数人”，现诸物多失。——《南京寺庙史话》"
752,斗场寺,鬥場寺,道场寺，明安寺,寺观/祠庙,宗教,南京市秦淮区中华门外,六朝,六朝,118.775,32.0143,,,,,"位于建康南郊的道场寺(又名斗场寺），是晋、宋之际的佛经翻译中心。
在法显回到建康的前一年(公元412年），他在长安结识的中印度高僧佛驮跋陀罗及其大弟子慧观，已由东晋大将刘裕请到道场寺。接着，与法显在北天竺会过面的高僧宝云也来到道场寺。宝云曾经在国外钻研并掌握了印度的古文字——“梵文”，这就为他的翻译佛经工作准备了良好的条件。法显在道场寺里大约住了5年左右，除了写成《佛国记》外，还翻译了佛经六部，共100多万字。佛驮跋陀罗则和上百名中国僧人，从公元418年起在道场寺共同翻译出大部头的《华严经》。其中宝云在道场寺从事译经工作的时间最长，据说他能一边看着梵文本的佛经，一边立即口译成流利的中文。经过他译成和订正的佛经有《无量寿经》等多种，质量都很髙，人们评论说：“江左译经，莫不推宝云为第一。”——《南京史话上》"
1768,大彩霞街,大彩霞街,,道路,景观描述,南京市秦淮区,清朝,清朝,118.7731,32.0258,,,,,草鞋街，在斗门桥南，讹为彩霞。——《十里秦淮桥道志》
183,玉兔泉,玉兔泉,,水体,动植物,夫子庙大成殿后,宋代,宋代,118.7834,32.0225,,,,,玉兔泉的来历与被称为“中国第一奸臣”的秦桧有关。秦桧在夫子庙学宫学习时，一天晚上看见一只白兔入地，他便派人到玉兔指引的地方进行挖掘，刚挖到1丈处，发现此处有泉眼，泉水清澈。等到秦桧考上状元之后，派人开凿造井，并亲自题写篆书“玉兔泉”。——中国孔庙
503,古林寺,古林寺,,祠庙,宗教,依据《陆师学堂新测金陵省全图》，补充1874年《上江两县志》、1909年《金陵杂志》定位,清朝,清朝,118.7485,32.0696,,,金陵,中日文化协会举行第三次常务理事会、国立音乐学院新建校舍破土动工、季刚与友人饮酒联句,古林寺，原名观音庵，为南朝宝志和尚所建，在清代与香林寺、毗卢寺并称南京城内三大名寺，被奉为“中兴戒律第一祖庭”，在佛教界有着重要的历史地位，有“天下第一戒坛”之称。康熙42年，康熙巡游时赐名“古林律院”，清乾隆二十四年（1759年），赐名“古林律寺”。——《南京寺庙史话》
2333,半边桥,半邊橋,,桥梁,交通,依据《陆师学堂新测金陵省全图》，补充1874年《上江两县志》、1908年《金陵杂志》定位,清朝,清朝,118.7967,32.0329,,,,,"又名柏川桥：亦称百川桥、位于今公园路明御河上。
柏川桥明南都之变，乞儿题诗自沈处也。此桥半在城内，半在城外，俗呼半边桥。《京城图志》云，在通济街。——《秦淮志》"
2064,申家巷,申家巷,,道路,人物姓氏,依据《陆师学堂新测金陵省全图》，补充1874年《上江两县志》、1908年《金陵杂志》定位,清朝,清朝,118.7935,32.0344,,,,,
2400,飞来剪,飛來剪,,山脉,史实传说与作品,依据《陆师学堂新测金陵省全图》，补充1874年《上江两县志》、1908年《金陵杂志》定位,清朝,清朝,118.7719,32.0407,,,,,"清代，钟山麓灵谷寺内有飞来剪。
光绪间，光莲重建山门及天王殿、大殿，余未及也。山门近又重修，额曰“深松觉苑”，有飞来剪、八功德水。——《金陵胜迹志》"
321,南京吏部,南京吏部,,衙署,政治军事,明故宫内,明代,明代,118.8119,32.0283,,,,,"朱棣迁都后，南京吏部负责负责南京地区官员六年一度的京察考功，北京吏部不得干涉。
南京吏部司属最闲无事。闽中文翔凤以文章名；山东王象春以气节名，在逆珰时称为门户，渠率号“二王”，一指御史述文，一指季木也。后此有徐公石麟、侯公峒曾，皆清真绝俗之标。乙亥，徐为考功主察，最有声。——《留都见闻录》"
1370,白土冈,白土岡,,山脉,景观描述,钟山西北,明代,明代,118.6059,32.5298,,,,,"明末顾炎武有诗云白土岗
《桃叶歌》
顾炎武
桃叶歌，歌宛转，旧日秦淮水清浅，此曲之兴自早晚。
青溪桥边日欲斜，白土冈下驱虞车，越州女子颜如花。
中官采取来天家，可怜马上弹琵琶。
三月桃花四月叶，巳报北兵屯六合。
两宫塞上行，日逐江东猎。
桃叶复桃根，残英委白门。
相逢冶城下，犹有六朝魂⑴。"
1790,泰仓巷,泰倉巷,,道路,愿景,斗门桥东北,清朝,清朝,118.7723,32.0285,,,,,泰仓巷，古时“泰”、“太”混用，故泰仓巷也称“太仓巷”。甘熙《白下琐言》载：“南市楼在斗门桥东北，今通太仓巷。”它南起升州路，北至千章巷。太仓，即古时皇家仓库，此“太仓”最有可能是东吴开凿运渎时孙权屯粮所在地之一而得名。泰仓巷位于南京市秦淮区升州路中段北侧，南起升州路，北至千章巷。——百度百科
1774,月牙巷,月牙巷,,道路,景观描述,依据《陆师学堂新测金陵省全图》，补充1874年《上江两县志》、1908年《金陵杂志》定位,清朝,清朝,118.7689,32.0319,,,,,地近禅林，香烟缭绕，命名所在，实取于兹。巷迤南西转，经封崇寺前再西，为月牙巷。——《金陵琐志九种上》
696,秣陵浦,秣陵浦,,水体,愿景,江宁区秣陵街道,六朝,六朝,118.8335,31.8367,,,秣陵镇,,"孙权时期的政治要地。
建安十七年(212)，孙权改秣陵为建业，并把县治从秣陵浦迁入今市区，在冶城(今朝天宫)之东新建了一座县城。据《建康实录》记载，建业“县治在故都城宣阳门内古御街东。”——《南京地名源》"
2086,小丰富巷,小豐富巷,,道路,交通,依据《陆师学堂新测金陵省全图》，补充1874年《上江两县志》、1908年《金陵杂志》定位,清朝,清朝,118.7764,32.0417,,,,,
2141,马家街,馬家街,,道路,人物姓氏,依据《陆师学堂新测金陵省全图》，补充1874年《上江两县志》、1908年《金陵杂志》定位,清朝,清朝,118.7768,32.0759,,,,,
785,土桥镇,土橋鎮,,行政区划,交通,土桥镇,宋代,宋代,119.0572,31.9361,,,,,据史志记载，三国时始成建落，后称土桥市，宋代改为土桥镇。
1869,大王庙,大王廟,,祠庙,宗教,依据《陆师学堂新测金陵省全图》，补充1874年《上江两县志》、1908年《金陵杂志》定位,清朝,清朝,118.7373,32.102,,,,,"在清代，大王庙设水营、造船厂和铁匠衙
下关在太平天国时期叫“天海关”。兼有军事防守和征收关税的双重职能。正佐梁凤超(后封贡王)主其事。另外，在下关鲜鱼巷口，设天朝提中关，负责水陆两路巡查和征税工作。在大王庙、水府祠设水营、造船厂和铁匠衙等。——《南京地名源》"
2640,信府苑,信府苑,,道路,城市与建筑,依据《陆师学堂新测金陵省全图》，补充1874年《上江两县志》、1908年《金陵杂志》定位,清朝,清朝,118.7783,32.0161,,,,,"信府苑地名源于明初信国公汤和。
信府河又叫信府河桥，古名桐树湾。明初信国公汤和久居于此，街遂以信府名之。附近的信府苑地名，也源于此。——《南京地名源》"
1824,复兴巷,復興巷,,道路,愿景,依据《陆师学堂新测金陵省全图》，补充1874年《上江两县志》、1908年《金陵杂志》定位,清朝,清朝,118.792,32.0302,,,,,复兴街（号牌1-93）南京下关区，二板桥所。南起二板桥，北至中山北路。传说曾有孙姓在此由穷变富，故名复兴街。曾名立新街。（1984年江苏省南京市地名录）——《我与老门牌的故事》
3430,新庄,新莊,,居民区,其他,依据《1930年代南京市实测新图》定位,近代,近代,118.8033,32.0782,,,,,有读者说南京有两个新庄，国展中心那边和大厂均有“新庄”。而记者调查后发现，南京的“新庄”竟有12个之多。这十二个新庄分别位于仙鹤门仙鹤村、葛塘镇新村、沿江镇汤庄村、葛塘镇四周村、龙潭镇花园村东、营房乡靖安村靖安河北、禄口镇山塘村境、丹阳镇许高村境、麒麟镇锁石村境、汤山镇中心村境和八百乡码头山东麓、大营郝村中部。十二个“新庄”中，历史最久远的是禄口镇的新庄，相传是明代泗洪县灾民迁徙到此，为了区别故土家园，命名为“新庄”。最“年轻”的新庄是大营郝村的新庄，1978年，大营郝大队各村都抽出部分村民到这里建房居住，是新的聚集区，得了“新庄”这个名字。命名最干脆的要数龙潭镇的新庄了，民国初年，张、王两家在这里建新房舍，为了和老宅区分开来，两家人一拍脑袋，这地方不是盖了新宅的吗？就叫新庄了。而命名曲折则要算是汤山的新庄。1373年，钱氏由仪征北门迁到汤山，后王氏由栖霞也迁了过来，两家共住一处，将村子命名为新庄。到建国前，王氏已经占了村里大多数，于是更名为王家村。建国初，又改成了“新庄”。——《南京“新庄”共有十二个》
2263,文德里,文德裡,,居民区,愿景,依据《陆师学堂新测金陵省全图》，补充1874年《上江两县志》、1908年《金陵杂志》定位,清朝,清朝,118.7924,32.052,,,,,
2358,龙江桥,龍江橋,,桥梁,城市与建筑,依据《陆师学堂新测金陵省全图》，补充1874年《上江两县志》、1908年《金陵杂志》定位,清朝,清朝,118.7355,32.0982,,,,,"近代，龙江桥附近有民办文化社团。
雅歌集，民办文化社团。为下关京剧票友活动中心。成立于民国十三年（1924）前后，地址在南京下关龙江桥虹门口附近。——《南京文化志下册》"
382,太平堤,太平堤,,水体,愿景,玄武湖太平门外,明代,明代,118.8071,32.0602,,,太平门、玄武、玄武湖、钟山,太平门、玄武、玄武湖、钟山,明洪武时期，玄武湖的面积再次缩小，约为南朝时期的三分之一。朱元璋建造南京京城城墙，初期在太平门外建造太平堤，致使湖水从钟山西麓脚下，至于太平堤的西岸。——《南京明清建筑》
1535,双井巷,雙井巷,,道路,城市与建筑,依据《陆师学堂新测金陵省全图》，补充1874年《上江两县志》、1908年《金陵杂志》定位,清朝,清朝,118.7875,32.0543,,,,,
2062,肚带营,肚帶營,,道路,政治军事,依据《陆师学堂新测金陵省全图》，补充1874年《上江两县志》、1908年《金陵杂志》定位,清朝,清朝,118.7853,32.0468,,,,,乾隆十五年（1750)教场中有阅兵台。十六年至三十年，高宗（即乾隆）四次恭奉皇太后銮舆南巡；及四十五年，四十九年皆于此阅兵。”今人民大会堂附近的“肚带营”，是当年通往小营之要道，买卖马鞍肚带的集市就设于此。——《南京地名源》
2066,八角井,八角井,,道路,城市与建筑,依据《陆师学堂新测金陵省全图》，补充1874年《上江两县志》、1905年《金陵杂志》定位,清朝,清朝,118.775,32.015,,,,,进中华门后西侧第一条巷子原名叫响铃巷，再向西是老地名八角井。——中国城市记忆工作室
2292,鞍辔坊,鞍轡坊,,其他建筑,物产与经济,依据《陆师学堂新测金陵省全图》，补充1874年《上江两县志》、1908年《金陵杂志》定位,清朝,清朝,118.7767,32.0188,,,,,"鞍辔坊因其附近作坊得名。
鞍辔坊位于中华路南段西侧，南起璇子巷，北至实辉巷。以明代此处为制造驾驭牲口鞍辔的作坊而得名。——网络检索"
1405,落星楼,落星樓,,其他建筑,景观描述,落星山上,清朝,清朝,118.9861,32.1597,,,,,"清代曾有人登落星楼望远，抒发感怀。
《无闷酬查德尹》
李符
登落星楼，望衣锦山，渺渺烟波千里。浑不省何年，醉牵吟袂。为报离情最苦，叹客与、黄花俱憔悴。香鲈绣鸭，梦中一艇，五湖秋水。
书寄。雁翎系。爱金缕歌残，玉笙吹起。问近日西泠，几人同倚。可惜梅仙鹤径，但牧马、斜阳青莎里。想背锦、怀古含愁，也似秣陵游子。"
2265,随家仓,隨家倉,,道路,山川,依据《陆师学堂新测金陵省全图》，补充1874年《上江两县志》、1908年《金陵杂志》定位,清朝,清朝,118.7626,32.0513,,,,,随家仓是南京的一个老地名，是取随园和小仓山之名复合而成。旧地图上的随家仓是指东起宁海路口，西至虎踞关巷口的一条街，后来成为一个虚地名，20世纪50年代中期统称广州路。
2051,南台巷,南台巷,,道路,史实传说与作品,依据《陆师学堂新测金陵省全图》，补充1874年《上江两县志》、1908年《金陵杂志》定位,清朝,清朝,118.7754,32.0386,,,,,晚清时期两江总督张之洞公馆的旧址在此，据说“南台”便是张之洞取自于《诗经·小雅》“南山有台，乐得贤也”中的“南”“台”两字。——百度百科
2313,商埠局,商埠局,,其他建筑,政治军事,依据《陆师学堂新测金陵省全图》，补充1874年《上江两县志》、1908年《金陵杂志》定位,清朝,清朝,118.7348,32.0986,,,,,商埠局在下关。商务局在复成桥。——《金陵杂志》
1586,牌楼巷,牌樓巷,,道路,城市与建筑,依据《陆师学堂新测金陵省全图》，补充1874年《上江两县志》、1908年《金陵杂志》定位,清朝,清朝,118.7665,32.0447,,,,,
2914,平江府街,平江府街,,道路,城市与建筑,依据《1930年代南京市实测新图》定位,近代,近代,118.7862,32.0246,,,,,民国九年，处分贡院，分上、中、下三等价额，听民间缴价领售，改筑市场。惟明远楼、至公堂、提调堂、监临堂、飞虹桥、士子号舍等，永远保存，以为纪念。中分马路，横直数条，向南方面，一名龙门街，一名平江府街；——《金陵杂志金陵杂志续集》
2468,莲萼洲,蓮萼洲,,水体,动植物,依据《陆师学堂新测金陵省全图》，补充1874年《上江两县志》、1908年《金陵杂志》定位,清朝,清朝,118.7904,32.0732,,,,,樱洲位于玄武湖西南，因盛产樱桃而得名，洲上有长达里余的曲折长廊。樱洲曾被称为“新洲”、“莲萼洲”、“欧洲”。——《南京地名趣话》
2119,竹竿里,竹竿裡,,道路,景观描述,依据《陆师学堂新测金陵省全图》，补充1874年《上江两县志》、1908年《金陵杂志》定位,清朝,清朝,118.776,32.0317,,,,,"清代，秦淮水流折而西，为竹竿里。
草桥由红土桥再北曰草桥，即北乾道桥。流折而西，为竹竿里，即古之竹格巷，以临竹格渚而名也。——《秦淮志》"
1863,八蜡庙,八蠟廟,,祠庙,宗教,依据《陆师学堂新测金陵省全图》，补充1874年《上江两县志》、1908年《金陵杂志》定位,清朝,清朝,118.7932,32.0296,,,,,"因为及时虫王刘猛，成为人们许下除虫期望的地方。
八蜡庙在火神庙侧，今废。（祀刘猛将军）——《金陵古迹图考》"
75,佛陀里,佛陀裏,,居民区,,据《建康实录》，今址暂不可考,六朝,六朝,,,,,,建初寺,"六朝时期居民区，因为有佛寺得名。
以始有佛寺，故号建初寺，因名其地为佛陀里。——《金陵琐志九种上》"
1534,文昌桥,文昌橋,,桥梁,愿景,依据《陆师学堂新测金陵省全图》，补充1874年《上江两县志》、1908年《金陵杂志》定位,清朝,清朝,118.7916,32.056,,,,,
613,金銮巷,金鑾巷,,道路,政治军事,依据《1930年代南京市实测新图》定位,近代,近代,118.78,32.0377,,,,南京地名源流与文人作品有关,以五行命名：金銮巷等。——《南京地名趣话》
2861,李家巷,李家巷,,道路,人物姓氏,依据《1930年代南京市实测新图》定位,近代,近代,118.7808,32.0371,,,,,这些日子长兴市民有百分之九十七八外出避难，留下的是老人和“固执己见的人”，以及来不及逃难的人，这些人是人口的百分之二三。占领了李家巷的日军在长兴火车站集结大军，然后分为二路西进：——《南京大屠杀始末采访录》
2811,湖南路,湖南路,,道路,城市与建筑,依据《1930年代南京市实测新图》定位,近代,近代,118.7742,32.0711,,,中山、中央党部,,1938年4月20日F.凯瑟琳•布莱恩小姐在本总领事馆就要求对其南京湖南路大同新村11号寓所财产损失赔偿作了宣誓证词。根据援引国务院2月18日晚上7时发给驻汉口大使馆78号电报相关部分的汉口大使馆1938年2月21日下午4时拍发供传阅的电报指示的条款，宣誓证词的原件已寄往国务院，一个副本发往驻东京大使馆。——《忍辱负重的使命美国外交官记载的南京大屠杀与劫后的社会状况》
2511,兴皇寺,興皇寺,,寺观,史实传说与作品,江宁区,清朝,清朝,118.8375,31.922,,,,,"南京古刹之一，组成了南京的佛文化。
泰始之初，帝创寺于建阳门外，敕猛为纲领。帝曰：“夫人能宏道，道藉人宏。今得法师，非直道益，苍生亦有光世望，可目为兴皇。”由是成号。及创造工毕，敕猛于寺开讲。后有道坚、慧鸾、慧敷、僧训、道明，并止兴皇寺。——《宋京师兴皇寺释道猛传》"
2508,灵味寺,靈味寺,,寺观,其他,依据《陆师学堂新测金陵省全图》，补充1874年《上江两县志》、1908年《金陵杂志》定位,清朝,清朝,118.7297,32.0699,,,,,"南京寺庙佛教文化的组成部分。
灵味寺，在钟山之侧，宋释昙宗尝居之，即著《京师寺塔记》者也。后有僧意、昙光、宝亮、静安，皆为灵味之禅宿焉。——《金陵琐志九种上》"
944,二水亭,二水亭,,园林,山川,"莫愁湖一带

",宋代,宋代,118.7587,32.0346,,,赏心亭,,"宋代，新建二水亭，十分壮观。
近又创二水亭，在门左，诚为壮观。——《入蜀记》"
1970,太平门街,太平門街,,道路,政治军事,依据《陆师学堂新测金陵省全图》，补充1874年《上江两县志》、1908年《金陵杂志》定位,清朝,清朝,118.8035,32.0538,,,,,
3551,中山桥,中山橋,,桥梁,山川,依据《1930年代南京市实测新图》定位,近代,近代,118.7349,32.0888,,,,,
1290,来宾桥,來賓橋,,桥梁,城市与建筑,中华门街道西街社区,明代,明代,118.7745,32.0102,,,,,来宾桥建于明初，规模不大，但做工考究，用的是经典的类似榫卯结构，桥拱部分两块石板之间，都有凹槽暗扣，让桥拱更为牢固。因为建在气势恢宏的聚宝门外，这座桥原先起名为国门桥。后因旁边一座酒楼为来宾楼故改名。——百度百科
3519,马家桥,馬家橋,,桥梁,人物姓氏,依据《1930年代南京市实测新图》定位,近代,近代,118.805,31.9952,,,,,《金陵杂志金陵杂志续集》中有多处对于马家桥的记载：“马家桥在石桥旁。藏金桥在小膺福。”“北门桥在故衣廊。马家桥在半边街。”等——《金陵杂志金陵杂志续集》
3555,邓府山,鄧府山,,山脉,人物姓氏,依据《1930年代南京市实测新图》定位,近代,近代,118.7624,31.9958,,,中华门、雨花台,,邓府山的邓愈墓，现存神道碑、墓碑各一块，石文臣、古武将各一对，还有石马、石马夫、石羊、石虎等石刻像各一对。这些石刻像威武雄壮，庄严肃穆，系明初陵墓石刻之精品。——《南京地名趣话》
1765,童子巷,童子巷,,道路,人物姓氏,依据《陆师学堂新测金陵省全图》，补充1874年《上江两县志》、1908年《金陵杂志》定位,清朝,清朝,118.7747,32.0239,,,牛市、颜料坊,,童子巷，宋夏锡[夏锡（生卒不详），衢州江山（今浙江衢州）人。咸淳三年（1267）丁卯科乡荐举进士，授奉议郎，官至太常博士。]居此，曾膺童子科。——《十里秦淮桥道志》
2312,交通银行,交通銀行,,其他建筑,物产与经济,依据《陆师学堂新测金陵省全图》，补充1874年《上江两县志》、1908年《金陵杂志》定位,清朝,清朝,118.7347,32.0953,,,新街口,,交通银行成立于1908年，主要经营工矿交通和公共事业贷款，当时在国内外设有若干分支机构。1910年，交通银行在南京成立了第一个分行。——百度百科
747,太后寺,太后寺,,寺观/祠庙,人物姓氏,冶城寺附近,六朝,六朝,118.7636,32.0334,,,,,"太后寺与冶城寺和僧人桓玄息息相关。
桓玄将冶城寺僧人驱赶到附近的太后寺中，废除冶城寺，改名别苑，作为自己的私家花园。他在别苑中广起楼台亭榭，“飞阁复道，延属宫城”，景象十分壮观。——《南京历代名号》"
3093,雨花路,雨花路,,道路,山川,依据《1930年代南京市实测新图》定位,近代,近代,118.7753,32.01,,,中华门、报恩寺、大报恩寺、秦淮、秦淮河、长干里、京城、雨花台,,"雨花路内设民主革命时期死难烈士公墓，缅怀1927-1949年的22年间被残酷杀害的10多万革命先烈。
    民主革命时期死难烈士公墓。位于南京市中华门外雨花路215号。建于1950年。1927年蒋介石叛变革命后，雨花台成为屠杀共产党人和爱国志士的刑场。1927-1949年的22年间，10多万革命烈士在这里被残酷杀害。为了缅怀先烈，1949年12月12日，南京市第二届各界人民代表会议决议，在雨花台兴建烈士陵园。——《南京文化志下册》
"
305,化龙亭,化龍亭,,古迹,史实传说与作品,鼓楼区幕府山上,元代,元代,118.7834,32.1173,,,,民国版《金陵四十八景图册》与乾隆版48景比较,经幕府寺登山......相传晋过江时，王丞相导开幕府于此。山前有五马渡、化龙亭，即元帝与彭城五王渡江处。先是，太安中童谣云：“五马浮渡江，一马化为龙。”遂以为名。——《金陵世纪金陵选胜金陵览古》
1574,郭府园,郭府園,,道路,人物姓氏,依据《陆师学堂新测金陵省全图》，补充1874年《上江两县志》、1908年《金陵杂志》定位,清朝,清朝,118.7758,32.0345,,,,,"清代时，郭府园的苋菜很有名，袁枚曾经在文中提到
王府园苋菜，只一种绿色。夏日取与虾米炒熟食，风味绝佳，任何菜不能及。乡前辈有客居他省者，每届夏日，辄思食此，而动归思。一如吾家先人季鹰，尝于秋日思吴中之莼菜、鲈鱼，而辞官归里也。今王府园，尽筑民屋，菜圃已废，又以门西万竹园苋为佳。东花园与张府园、郭府园均次之焉。——《随园食单》"
