地名id,地名,繁体地名,别名,地名类别,景观类型,地理位置,朝代,时期,经度,纬度,相关作品,相关人物,相关地点,相关事件,地名描述
1963,承恩寺,承恩寺,,祠庙,史实传说与作品,依据《陆师学堂新测金陵省全图》，补充1874年《上江两县志》、1908年《金陵杂志》定位,清朝,清朝,118.7808,32.026,,利玛窦,金陵、三山、三山街、牌楼,,承恩寺始建于明景泰二年（1451年），该处原为大宦官王瑾的故第，景泰二年(1451年），王瑾奏请舍宅为寺，赐额“承恩寺”。清代毁于大火。——《南京寺庙史话》
1383,仪凤门,儀鳳門,,城门,动植物,依据《陆师学堂新测金陵省全图》，补充1874年《上江两县志》、1908年《金陵杂志》定位,清朝,清朝,118.7428,32.0939,,太平,聚宝门、通济门、兴中门、钟阜门、太平门、金川门、京城、神策门、朝阳门、狮子山、静海寺、定淮门、鼓楼、清凉门、三山、卢龙山、三山门、石城门、水西门、中华门、中山、栅栏门、中山门、江东门、南门、天妃宫、挹江门、钟山,,"清时，仪凤门内设立了江南水师学堂。
继在福建创办水师学校之后，天津、广东等地也设立了此类学校。李鸿章在给皇帝的奏折中提到：“海军人才以学堂为根本，北洋现有各师船甚殷，非多设学堂，不足以资造就。”大臣铁良也曾在巡视江浙防务奏折中称:两江水域防务不容忽视。1890年(光绪十六年)清政府即在南京下关仪凤门内正式设立了江南水师学堂。——《南京明清建筑》"
221,天庆观,天慶觀,,寺观/祠庙,宗教,朝天宫,宋代,宋代,118.7702,32.0365,,,朝天宫、冶城、王庙,,"宋时苏轼在天庆观观乳泉并作赋
苏轼有《天庆观乳泉赋》诗
原文:阴阳之相化,天一为水。六者其壮,而一者其稚也,夫物老死于坤,而萌芽于复。故水者,物之终始也。意水之在人寰也,如山川之蓄云,草木之含滋,漠然无形……"
1059,天津桥,天津橋,虹桥；护龙桥；蔡公桥；内桥,桥梁,虹桥,城市与建筑,元代,元代,118.7888,32.0376,,,行宫、内桥、虹桥、南唐宫、青溪、建康、西虹桥、东虹桥、南门、大市、大市桥、金陵,,"天津桥是南京宫门虹桥在元代的名字。
宋末年，又把护城河加宽到30丈，深1丈5尺。当时，建康城内的布局是：将南唐宫城改为行宫，宫门前的虹桥改名“天津桥”(今内桥）。——《南京史话上》"
1398,江东门,江東門,,城门,方位与位置,江东门,清朝,清朝,118.7369,32.0318,,太平,新河、上新河、水西门、驯象门、京城、中山、沧波门、观音门、三山、上元、上元门、长江、白鹭洲、凤台门、金陵、麒麟门、三山门、仪凤门、雨花台、栅栏门,,"清朝时期，曾有古人与友人在江东门聚会赏景。
《蔡五携尊过江东门寓轩》
屈大均
繇来江左客，第五最知名。
青岁偏闻道，丹砂亦寄情。
行携春酒美，坐爱夕堂清。
罂粟花枝下，欢看稚子迎。"
152,亭山,亭山,,山脉,城市与建筑,溧水亭山,宋代,宋代,118.9714,31.6689,,蒋山,蒋山、秦淮、青溪、青龙山,,
595,察院,察院,,衙署,政治军事,依据《陆师学堂新测金陵省全图》，补充1874年《上江两县志》、1908年《金陵杂志》定位,清朝,清朝,118.7889,32.0266,,太平,立法院、太平门、玄武、玄武湖、中山,各地禁演乱弹等戏、钱云鹤举行个人画展、南京太平门外环胡村务本蚕种制造厂发现明初刑部都察院和断事府的遗址,为清朝监督机构，沿袭明代规制，行使督察百官职责。
142,阴山,陰山,,山脉,景观描述,据《景定建康志》，今址暂不可考,宋代,宋代,,,,,,,
194,琅邪城,琅邪城,,古迹,,据《景定建康志》，今址暂不可考,宋代,宋代,,,,,白下、金城、白下城,武帝让毛惠秀画《汉武北伐图》,
1085,利涉桥,利涉橋,,桥梁,秦淮区桃叶渡附近,愿景,元代,元代,118.7871,32.023,,,桃叶渡、秦淮、贡院、文德桥、贡院街、金陵、淮青桥、夫子庙、淮清桥、板桥、钓鱼巷、淮水、青溪、姚家巷,,《金陵待征录》卷一：利涉桥，昔桃叶渡也。孝陵卫金云甫，少无赖，晚好佛，徙居渡口，见渡者多溺，捐建木桥。太守李正茂名之曰：利涉。——《十里秦淮桥道志》
65,左卫,左衛,,衙署,,据《建康实录》，今址暂不可考,六朝,六朝,,,,,右卫、卫尉、羽林右卫、丹阳尹、东宫,,"六朝时期官署。
案，晋初，太子宫在宫西，虽东宫，实有皇后之宫，今去台城西南角外，西逼运沟。至此年，烈宗始新于宫城东南，移左卫营，以其地作之，卽安帝为太子所居宫也。——许嵩《建康实录》"
2509,法云寺,法雲寺,,寺观,景观描述,下关三汊河附近,清朝,清朝,118.8145,32.0654,,,,,"南京众寺庙之一，弘历皇帝曾到此游玩。
《竹炉山房歌叠惠泉烹竹垆韵》
弘历
山下出泉易所闻，八功德品梵帙分。
同归殊途何思虑，辞多应始躁者群。
知然乃复辨甲乙，笑予未足称绝尘。
前年揽景法云寺，无暇翻彼贝叶文。
右廊展转入茶室，古梅对我吹幽芬。
竹鼎小试烹玉乳，腾声四百年以陈。
画图诗咏萃四卷，前呼后唱情弥敦。
仿制筠垆忽已得，底须较量传火薪。
灵泉第一况在迩，无劳水递驰纷纷。
山房两间取.........."
1529,香林寺,香林寺,,寺观,愿景,依据《陆师学堂新测金陵省全图》，补充1874年《上江两县志》、1908年《金陵杂志》定位,清朝,清朝,118.8133,32.0544,,太平、曹雪芹,太平门,,"红学专家考证出香林寺清朝时是江宁织造府曹家的家庙，曹雪芹在《红楼梦》中写到的铁槛寺就是以香林寺为原型。
清代，因康熙三十八年（1699年）皇帝玄烨第三次南巡时，进兴善寺游历，见林木茂盛，闻鸟语花香，遂改名“香林寺”……康熙的亲信、江宁“织造部堂曹大人(曹寅)买施秣陵关田二百七十余亩、和州(今安徽和县）田地一百五十余亩”，使香林寺再度振兴。——《南京明清建筑》"
698,前湖,前湖,燕雀湖,水体,方位与位置,燕雀湖,六朝,六朝,118.828,32.0465,,太平,燕雀湖、钟山、青溪、玄武、玄武湖、护城河、中山、后湖、中山门、半山园、秦淮、太平门、金陵、小桃园、孝陵,,"地处钟山南，有燕雀护陵的故事，与昭明太子萧统有关。
昭明太子早逝，梁武帝十分悲痛，便将他生前喜欢的一只琉璃碗和一只紫玉杯随葬。琉璃碗系西域进贡之物，极为稀见，被人们视为珍宝。有个太监为得到此稀世珍宝，竟然盗墓。当太监掠取珍宝回归时，突然数万只燕雀飞来扑击太监。这种奇怪现象，引起了守护官的警觉，命人把太监绑缚起来，并从身上搜出盗掘的珍宝。燕雀护陵的消息传到宫里，梁武帝十分惊异，诏令将珍宝赐给太孙，并重新整修萧统墓。当封墓时，又有数万只燕雀衔泥飞来增土，筑起了很大的墓包。因此，后人便称前湖为“燕雀湖”。——《南京地名趣话》"
1155,能仁寺,能仁寺,,寺观,南京城内南厢嘉瑞坊,愿景,元代,元代,118.7675,32.0032,,蒋山,蒋山、天界寺、鸡鸣寺、天禧寺,,"《送康穆庵赴福州能仁寺席》
张昱
佛运兴隆此一机，尊师何负七条衣？
讲经春殿人天卫，咒钵夜堂风雨归。
花为散来春冉冉，柳从攀后思依依。
幽兰荔子南方物，笼护函封寄莫稀。"
1510,太平桥,太平橋,,桥梁,愿景,依据《陆师学堂新测金陵省全图》，补充1874年《上江两县志》、1908年《金陵杂志》定位,清朝,清朝,118.7573,32.0839,,颜真卿,秦淮、放生池、青溪、竺桥、浮桥、笪桥、珠江路,,
746,冶城寺,冶城寺,,寺观/祠庙,城市与建筑,朝天宫所在址,六朝,六朝,118.7634,32.0325,,,,,"冶城寺与南京佛教文化和建筑息息相关。
宫在石城门（今溪西门）内冶城山，晋为冶城寺。刘为总明观。杨吴为紫极宫。宋立文宣王庙，后改为天庆观，大中祥符间，赐为驾祥符宫。元为元妙观，又升驾永毒宫。明露朝天宫，有习仪亭。同治四年改建府学交庙，高栋飞甍，制度宏丽。宫西高阜上，即晋卞壶墓也。"
1386,朝阳门,朝陽門,,城门,愿景,依据《陆师学堂新测金陵省全图》，补充1874年《上江两县志》、1908年《金陵杂志》定位,清朝,清朝,118.8218,32.0416,,太平、蒋山,中山、太平门、中山门、聚宝门、神策门、通济门、仪凤门、京城、钟山、钟阜门、海陵、金川门、石城门、中华门、定淮门、和平门、三山、三山门、水西门、清凉门、挹江门、汉西门、皇城、蒋山、孝陵、光华门、洪武门、南门、瓮城,,"清洪繻有诗题朝阳门外柳树景色
《金陵杂诗》（作者注：「二月二十夜。」）
洪繻
虎踞龙蟠古帝阊，湖山虽歇尚苍苍。
微茫无数前朝迹，叠嶂长江绕建康。
下关浦口水悠悠，阛市东南占上流。
狮子山头白门路，兵旗不似阅江楼。
残泉犹有五龙澄，四角皇城剩两棱。
游遍帝乡如驿传，明宫过后过明陵。
一路青青叫画眉，朝阳门外柳如丝。
马蹄踏过钟山背，何处昭明饮马池。
朱雀桥空古色稀，燕飞不见旧乌衣。
秦淮桃叶流如故，画舫青溪日暮归。
废苑荒台感不禁，青溪流水到而今。
祇馀一曲残杨柳，无复当年九曲深。
无数遥峰对近鬟，楼头青压水西关。
南唐风景今安在，一簇清凉寺里山。
寓公好事有袁郎，士女风流映小仓。
今日随园鸿爪尽，茫茫二十四云房。
孤冷偏能耐久留，一层半亩在山头。
随园不及龚高士，残照秋风扫叶楼。
东吴阅后又南朝，淮色山光两寂寥。
故国周遭都已渺，石头城去大江遥。"
487,瓮城,甕城,,古迹,,南京明城墙范围,清朝,清朝,,,,太平,中华门、通济门、京城、水西门、汉西门、和平门、神策门、三山、太平门、中山、朝阳门、聚宝门、中山门,,"中国建筑史上少见的城门内的瓮城。
南京明城墙的内瓮城一反传统瓮城设置在城门外的惯例，而设置在城门内侧，成为中国古代瓮城建造史上的一朵奇葩。内瓮城在体现“国之利器，不可示人”的道家思想的同时，又加筑若干“藏兵洞”，在冷兵器时代大大增强了城墙的军事防御能力。——《南京明清建筑》"
704,栅塘,柵塘,,水利设施,景观描述,南京市区东南,六朝,六朝,118.7506,32.0204,,,秦淮、横塘、建康、五城,,"六朝时，栅塘既用于防水也用于军事
六朝时期，秦淮河、青溪两岸还筑堤立栅，既用于防水，亦作为都城军事防线。主要有青溪栅、栅塘、横塘等。——《南京城墙志》"
110,瓦棺寺,瓦棺寺,瓦官寺,寺观/祠庙,物产与经济,秦淮区花露北岗12号,唐代,唐代,118.767,32.0196,,,,,"唐代，瓦棺寺是文人描绘佛教禅意的胜地
《登瓦棺寺阁》（节选）
罗隐
下盘空迹上云浮，偶逐僧行步步愁。
暂憩已知须用意，渐来争忍不回头。"
1011,竹格巷,竹格巷,,道路,鼎新路东，评事街区域,山川,元代,元代,118.7736  ,32.0304,,,,,草桥由红土桥再北曰草桥，即北乾道桥。流折而西，为竹竿里，即古之竹格巷，以临竹格渚而名也。——《秦淮志》
519,行台,行臺,,古迹,政治军事,依据《陆师学堂新测金陵省全图》，补充1874年《上江两县志》、1908年《金陵杂志》定位,清朝,清朝,118.783,32.0257,,,扬州、都督府、督府、建康,,"隋唐以及元朝的政治中心地带，明清时期没落。
设治于南京的最高衙署先后有唐初武德年间的东南道行台和扬州大都督府，以及乾元年间的浙江西道节度使衙，曾统领江淮以及江南的数州之地，但为时甚短，累计不过约10年。——《南京城墙志》"
1227,温峤墓,溫嶠墓,,陵墓,幕府山西,人物姓氏,元代,元代,118.7721,32.1198,,,幕府山、建康,,"温峤墓在幕府山西侧。
墓在幕府山西，相传为温峤墓，实则温峤始终未归葬金降，惟墓有古砖，系六朝时墓无疑。——《金陵古迹名胜影集》"
1943,永宁寺,永寧寺,,祠庙,愿景,依据《陆师学堂新测金陵省全图》，补充1874年《上江两县志》、1908年《金陵杂志》定位,清朝,清朝,118.7773,32.0034,,,雨花台,,"永宁寺内的第二泉久负盛名，为清代文人所喜爱
清代许振禅、方伯题联“独携天上团圆，来试人间第二泉”。——《南京明清建筑》"
1264,孝陵卫,孝陵衛,,衙署,政治军事,紫金山南麓。,明代,明代,118.8553,32.0354,,太平、朱元璋,中山、灵谷寺、中山门、金山、栖霞、工兵学校、金陵、燕子矶、钟山,,"保卫孝陵的卫所。
禁约碑以东为孝陵卫，该处曾驻兵五千余人，为朱元璋死后设置的保卫孝陵的卫所。——《南京明清建筑》"
2391,卫桥,衛橋,,桥梁,城市与建筑,依据《陆师学堂新测金陵省全图》，补充1874年《上江两县志》、1908年《金陵杂志》定位,清朝,清朝,118.8292,32.0431,,,斗门桥、南门、镇淮桥、尊贤坊,,"明朝，卫桥用于拦住进入孝陵的人员。
在明朝时候，孝陵被列为禁区，一般人员是不准进入的。有一道高大的“皇墙”(俗称红墙）拦住人们直接进入孝陵。这道皇墙起自今中山门外，经过卫桥、卫岗和灵谷寺，一直到孝陵卫为止，连同孝陵西面和北面的皇墙，长度共达22.5公里。——《南京史话上》"
126,武定桥,武定橋,,桥梁,愿景,镇淮桥东北,宋代,宋代,118.781,32.0195,,,秦淮、镇淮桥、文德桥、长乐路、浮桥、南门、钞库街、夫子庙、新桥、金陵、牌楼、油坊巷、东牌楼、东水关、斗门桥、贡院、虹桥、建康、秦淮河、上浮桥、饮虹桥、东园、剪子巷、聚宝门、下浮桥、信府河、中山、朱雀桥,朱元璋立富乐院、金陵市井,始建于南宋淳熙中（1174〜 1189)，因武定坊而得名。景定二年（1261)马光祖重 建，仍称原名。为3孔石拱桥。——《南京地名大全》
1626,金川门,金川門,,城门,山川,依据《陆师学堂新测金陵省全图》，补充1874年《上江两县志》、1908年《金陵杂志》定位,清朝,清朝,118.7541,32.0888,,太平,通济门、太平门、钟阜门、神策门、仪凤门、定淮门、京城、和平门、清凉门、玄武、聚宝门、中央门、朝阳门、光华门、三山、三山门、水西门、挹江门、中山、狮子山、石城门、中华门、中山门、新民门、兴中门、小北门、玄武门、小东门、玄武湖、汉西门、上元,,"此地是南京城墙文化的一部分。
京城开筑城门十三座：自通济门按顺时针方向城门分别为：聚宝门、三山门、石城门、清凉门、定淮门、仪凤门、钟阜门、金川门、神策门、太平门、朝阳门、正阳门。城门上皆建有敌楼，每门有木门和千斤闸各一道。城门的瓮城以通济门占地最广，聚宝门最为壮观，而通济、聚宝、三山、石城等城门的内瓮城又各具特色。——《南京明清建筑》"
137,张山,張山,,山脉,人物姓氏,古南京城东南,宋代,宋代,118.9578,31.9953,,方山,方山,,
1417,日观台,日觀台,,古迹,景观描述,鸡笼山上,清朝,清朝,118.7859,32.0616,,,鸡笼山,,日观台是古天文、气象观测台遗址。“清康熙八年（1669），天文仪器运往北京，仅存遗址。”——《南京文化志下册》
62,清庙,清廟,,祠庙,,据《建康实录》，今址暂不可考,六朝,六朝,,,,,,,"六朝时期宗庙。
秋七月，使大匠卿薛珝营寝室，号曰清庙。——许嵩《建康实录》"
923,应潮井,應潮井,,水体,其他,紫金山南麓,宋代,宋代,118.8543,32.0679,,,,,"因其随江潮而增缩的自然规律，应潮井常被诗人用来抒发世事轮回，人生无常的怅惘。
《应潮井》（节选）
马之纯
有井无冬亦无夏，与潮俱往又俱还。
想应透彻深无底，怪得浮沉转似环。"
485,三山街,三山街,,道路,山川,依据《陆师学堂新测金陵省全图》，补充1874年《上江两县志》、1908年《金陵杂志》定位,清朝,清朝,118.779,32.0241,,,南门、内桥、花市、新桥、承恩寺、南门大街、建康、京城、北门桥、大功坊、花牌楼、净觉寺、聚宝门、牌楼、水西门、中正街,金陵市井,"清初，三山街成了统治者处决犯人的刑场之一
清代初年，市场萧条，三山街成了统治者处决犯人的刑场之一。1661年清顺治皇帝死后，清政府曾在三山街附近一次斩杀多人，著名的文学评论家金圣叹也以“抗粮哭庙，震惊先帝之灵”的罪名被斩首于此。《辛丑纪闻》记载一次杀人的情况。""""至辰刻，狱卒子狱中取出罪人，背插招旆，口塞栗木。亲人观者稍近，则披甲者枪柄刀背乱打。俄而炮声一震，一百二十一人皆毙死。披甲乱驰，群官皆散。法场之上，惟血腥触鼻，身首异处而已。""""——百度百科"
782,宝公院,寶公院,,寺观/祠庙,宗教,灵谷寺,唐代,唐代,118.8626,32.0572,,蒋山、太平,蒋山,,"唐代，宝公院与佛教文化息息相关
葛寅亮《金陵梵刹志》：宋元嘉中，僧宝志建道林寺。梁天监十三年，武帝为志公建塔于山南玩珠峰前，名开善精舍，更为寺。唐乾符中，改宝公院——《明孝陵志》"
692,烈山,烈山,,山脉,人物姓氏,江宁区烈山,六朝,六朝,118.5389,31.8337,,,孝陵、三山、钟山,,清道光《金陵览胜诗考》称:“陈永定初，王琳造 船千艘，张帆直下，窥台城，值风急泊于此山，陈将侯 瑱火炮焚其舟，琳遂大败，土人思瑱功烈，故名烈山。”——《南京地名大全》
422,邀笛步,邀笛步,,古迹,,"南京市旧城东南，青溪桥右
",明代,明代,,,,,青溪,青溪,《清稗类钞》：钓鱼巷者，明武宗钓鱼之所也，题为古钓鱼巷。桃叶渡在其西，邀笛步在其东，巷尽于此。——《十里秦淮桥道志》
203,赏心亭,賞心亭,,园林,景观描述,秦淮区水西门广场西,宋代,宋代,118.7632,32.0299,,马光祖,折柳亭、秦淮、金陵、水西门、白鹭亭、二水亭、水亭、浮桥、横江馆、建康、下浮桥,,"南宋抗金将领、爱国词人辛弃疾在多次前来建康筹划恢复中原大计而毫无结果时,登高赏心亭作词
《水龙吟·登建康赏心亭》
辛弃疾
楚天千里清秋，水随天去秋无际。遥岑远目，献愁供恨，玉簪螺髻。落日楼头，断鸿声里，江南游子。把吴钩看了，栏杆拍遍，无人会，登临意。
休说鲈鱼堪脍，尽西风，季鹰归未？求田问舍，怕应羞见，刘郎才气。可惜流年，忧愁风雨，树犹如此！倩何人唤取，红巾翠袖，揾英雄泪？"
208,水亭,水亭,,园林,山川,据《景定建康志》，今址暂不可考,宋代,宋代,,,,吴敬梓,秦淮、淮水、秦淮水、赏心亭,,"宋代诗人杨万里至南京时，在水亭游玩，赋五言诗
《晓登水亭》
露气仍荷气，秋风更晓风。
身兼水亭子，双堕玉壶中。"
695,江宁浦,江寧浦,,水体,愿景,江宁县西南,六朝,六朝,118.8452,31.9552,,,,,"江宁县就是以此得名，大破齐师的地方。
在西南者为江宁浦，故县以江宁名。陈庆之大破齐师，擒萧轨处，即此。——《摄山志》"
945,折柳亭,折栁亭,,园林,史实传说与作品,莫愁湖公园南侧,宋代,宋代,118.7568,32.0341,,,赏心亭、虹桥、秦淮、饮虹桥、浮桥、建康,,"宋代，文人墨客多在折柳亭送别并留下诗篇。
《发金陵折柳亭》
张耒
津亭折得绿杨枝，更看春风向手吹。
建业城边春已老，连天荒草燕双飞。"
854,飞虹桥,飛虹橋,,桥梁,其他,南京市秦淮区,宋代,宋代,118.7835,32.0224,,,,,"飞虹桥在科举时代有着非常重要的作用，它是江南贡院内、外帘的分界点。
《景定建康志》卷一六《疆域志二•桥梁》亦云：“南唐有虹桥、小虹桥、飞虹桥，皆傍宫桥也。”又引杨文公《谈苑》云：“徐常侍铉仕江南日，尝直澄心堂，每被被入直，至飞虹桥，马辄不进，裂鞍断辔，箠之流血，掣缰却立。”——《南京城墙志》"
187,乌龙潭,烏龍潭,,水体,动植物,位于南京市中心鼓楼区广州路西侧,宋代,宋代,118.7601,32.0472,,太平、魏源、颜真卿,放生池、清凉山、灵应观、龙蟠里、蛇山、石头城、北门桥、金陵、秦淮,乌龙潭盛名原因、吴应箕筑“吴氏园”、城西成为人文荟萃之地,三国时，乌龙潭名为清水大塘、芙蓉池。晋代传说潭中有四处泉眼，终年喷涌不息。某年六月十九日，四条乌龙环绕泉眼戏水。以后，每年乌龙准时出现，乌龙潭由此而得名。若干年后四泉眼相继匿迹，乌龙亦不再现，然乌龙潭依旧风景优美。——百度百科
1385,神策门,神策門,,城门,愿景,和平门,清朝,清朝,118.7821,32.0909,,太平、郑成功,太平门、和平门、聚宝门、朝阳门、京城、金川门、三山、仪凤门、中华门、中山、清凉门、石城门、玄武、中山门、钟阜门、定淮门、三山门、通济门、海陵、瓮城、后湖、上元、挹江门、汉西门、玄武湖、石灰山、土山、上元县、玄武门、鼓楼、金陵、石头城、市政府、水西门、台城、中央门,,"清清顺治十五年（1658）郑成功北伐金陵败于神策门下，清廷遂改称“得胜门”。
神策门明都南京城门遗存。位于南京市中央门东南。神策门是明初朱元璋所建明京城中13座城门之一。清顺治十五年（1658）郑成功北伐金陵败于神策门下，清廷遂改称“得胜门”。1928年改为和平门。——《南京文化志下册》"
1065,崇道桥,崇道橋,,桥梁,冶城正南方向,愿景,元代,元代,118.7682,32.033,,,斗门桥、秦淮,,仓巷北端之桥，古代叫“仓桥”，或称“仓巷桥”。因稍北有冶山道院，又称“崇道桥”。清同治年间，在朝天宫故址建江宁府学后，此桥改称“道济桥”。——《南京地名趣话》
938,未央宫,未央宮,,古迹,愿景,通济门东北,宋代,宋代,118.7976,32.0265,,,东府城、石头城,,
728,西州桥,西州橋,,桥梁,城市与建筑,朝天宫西古运渎上,六朝,六朝,118.7661,32.0369,,,冶城、运渎、建康、朝天宫,,"运渎上六桥之一。
运渎故道因运渎上六桥自宋代以来多历历可考，故其路线古今皆无多大分歧。据《景定建康志》卷一六《疆域志二•桥梁•运渎六桥》，西州桥在笪桥(今太平桥)西。——《十里秦淮道志》"
1335,三井冈,三井岡,,山脉,其他,江宁凤凰山一带,明代,明代,118.8089,31.8215,,,,,"明代诗人也在三井冈留下许多诗句，以送别诗为主
《金陵行送王廷助》（节选）
乌斯道
波涛接天天堑成，钟山故作云锦屏。
三井冈头烟树清，白下左顾琅琊城。"
182,汤泉,湯泉,,水体,山川,南京市浦口区,宋代,宋代,118.5896,32.1005,,,江浦、江浦县、汤山,,"作为洗浴之地，宋代在汤泉的诗文一般比较轻松
《汤泉才到便问浴处何在戏呈长老》
李之仪
欲从旷口过金陵，不惜汤泉两日程。
因就故人求一浴，何妨随例得身轻。"
1440,午门,午門,,城门,方位与位置,午门,清朝,清朝,118.8123,32.0412,,方孝孺、朱元璋、蒋山,端门、承天门、东华门、奉天门、西华门、玄武、右掖门、皇城、明故宫、社稷坛、洪武门、玄武门、左掖门、太庙、西安门、外五龙桥、御道、内五龙桥、北安门、南门、京城、午朝门、东安门、护城河、蒋山、谨身殿、御河、中华门,,"系明宫城正门。
三阙，上覆重楼五（今亡），崇闳庄丽，俗所谓五凤楼也。两观间掖门，东西相对。今双阙已拆去，已非当年旧观，然城基犹在，规制一如北京之午门。——《南京明故宫》"
756,耆阇寺,耆闍寺,袛阇寺;普缘寺,寺观/祠庙,宗教,鸡笼山西。,六朝,六朝,118.7849,32.0613,,,,,"耆阇寺是南京六朝的著名寺庙，与南京佛文化息息相关。
耆阇寺经宋、齐两代发展，到梁代时已成为南朝的著名寺庙，占地广阔，僧侣众多，殿宇依山建造，高屋飞檐，富丽堂皇。寺内香客如云，终日烟雾缭绕，钟磬之声不绝。耆阇寺的历任住持多为大德高僧，如知识渊博、曾撰写《续高僧传》的道登法师,在齐永元二年（500年）参加齐隆寺法镜大师的圆寂法事时，陈说前贤高论，字字珠玑，倾动四座，赞声不绝。另一位住持是安廪法师，他于梁太清元年（547年）从徐州来到南京，梁武帝萧衍亲自敬供迎接，并曾邀约他住在宫内讲授《华严经》。陈永定元年（557年），他又被召入内殿，敕住耆阇寺，经常入宫给陈武帝讲授经史。——《南京寺庙史话》"
