地名id,地名,繁体地名,别名,地名类别,景观类型,地理位置,朝代,时期,经度,纬度,相关作品,相关人物,相关地点,相关事件,地名描述
1554,通贤桥,通賢橋,,桥梁,愿景,依据《陆师学堂新测金陵省全图》，补充1874年《上江两县志》、1908年《金陵杂志》定位,清朝,清朝,118.7867,32.0514,,,,,"附近有业宅，道光年间继承者卖掉宅子赈灾。
旁为通贤桥，有秦尚书承业宅。道光中鬻以助振。——《金陵琐志九种下》"
204,白鹭亭,白鷺亭,,园林,动植物,"莫愁湖一带

",宋代,宋代,118.7584,32.035,,,赏心亭,,"宋朝时期，苏轼曾在白鹭亭题字
白鹭亭，接赏心亭之西，下瞰白鹭洲，柱间有东坡留题。景定元年，马公光祖重建"
745,新亭寺,新亭寺,,寺观/祠庙,城市与建筑,新亭岗,六朝,六朝,118.7391,31.9793,,,,,"新亭寺与史学研究息息相关。
新亭一带，古代多寺庙。据《南朝佛寺志》载：晋孝武帝太元五年立新亭寺，宋孝武帝时改曰中兴寺。宋明帝时易名天安寺。——《南京地名源》"
2773,贡院街,貢院街,,道路,政治军事,依据《1930年代南京市实测新图》定位,近代,近代,118.7867,32.0237,,,夫子庙、秦淮、桃叶渡、西街、贡院西街、秦淮河、金陵、姚家巷、利涉桥、龙门街、东牌楼、建康、建康路、牌楼、文德桥,,一洞天电影院民国十五年（1926）开业。位于夫子庙贡院街。由旧屋改建，小规模，长条凳，容300余人。是南京第二家影院。放映无声片。营业状况甚佳，不久即趋萧条并倒闭。——《南京文化志下册》
861,周郎桥,周郎橋,,桥梁,人物姓氏,江宁区周郎桥,宋代,宋代,119.0562,31.9335,,,,,"周郎桥位于湖熟镇。
《石迈古迹篇》：旧传周瑜征笮融至此桥，因名。《景定志》：下临横塘。疑有讹字，或“下临倪塘”耳。索墅小桥，因是以为二乔遗迹，名曰姊妹，则不值一噱。又江宁镇桥，亦附会为周郎，后黎村六塘桥讹为陆郎，有“陆郎古迹”小碣，《吕志》收之，恐非典要。——《留都见闻录》"
1649,栖霞街,棲霞街,,道路,景观描述,栖霞镇,清朝,清朝,118.9484,32.1506,,,,,《上江两县志》卷五《城厢》：有“栖霞街”。——汉程网
750,开福寺,開福寺,,寺观/祠庙,愿景,冶城东南，万寿桥西,六朝,六朝,118.8033,32.0259,,,,,"开福寺与南京的佛教文化息息相关。
开福寺在冶城东南，晋时之所建也。宋元嘉八年，有尼慧果、净音，共请求那跋摩受戒，遂改为景福尼寺。南唐避讳，又改景福为永福云。——《金陵琐志九种上》"
1396,夹冈门,夾岡門,,城门,方位与位置,夹岗门,清朝,清朝,118.8074,31.9782,,,,,"附近有张王庙，每年二月八日有祭祀。
二月八日祀祠山大帝，夹冈门外有张王庙，前后三日必有风雨，遂有“张王老爷吃冻食，请客风送客雨”之谚。——《金陵岁时记》"
1547,广艺街,廣藝街,,道路,愿景,依据《陆师学堂新测金陵省全图》，补充1874年《上江两县志》、1908年《金陵杂志》定位,清朝,清朝,118.7822,32.0313,,,,,"趾斋所在地。
趾斋在广艺街，江宁顾戢针观察赐书园。听事后入园，左右皆紫竹。有紫薇一株，极其茂盛。循廊至斋，额曰“趾斋”，以寓止足不复出山之意。——《金陵琐志九种下》"
1788,红土桥,紅土橋,,桥梁,景观描述,依据《陆师学堂新测金陵省全图》，补充1874年《上江两县志》、1908年《金陵杂志》定位,清朝,清朝,118.7729,32.0299,,,斗门桥、笪桥、随园、运渎、草桥,,《运渎桥道小志》说：“红土桥者，南乾道桥之俗名也。尝有掘地深三尺者，见其下土色皆红，而知见称之由，盖冶麓之余气焉。”——《南京地名源》
2103,玉带巷,玉帶巷,,道路,景观描述,依据《陆师学堂新测金陵省全图》，补充1874年《上江两县志》、1908年《金陵杂志》定位,清朝,清朝,118.7724,32.0259,,,,,玉带巷，东起上浮桥，西至渡船口。传说：古时有个皇帝巡视南方，路过此地遗失玉带一根，故名。——《十里秦淮桥道志》
1296,江东桥,江東橋,,桥梁,方位与位置,茶亭东街，江东门纪念馆外,明代,明代,118.736,32.0375,,,,,"江东桥明初重要交通要道，位于江东门外得名。
洪武二十四年（1391)二月甲子建成，置千户所，铸印给之。同年七月丁亥，造城门外的江东桥，以通江边，该城门遂成皇室迎送重要宾客至江边码头所过之要津。——《南京城墙志》"
3103,长乐路,長樂路,,道路,愿景,依据《1930年代南京市实测新图》定位,近代,近代,118.7862,32.0176,,,武定桥、秦淮、中华门、马道街、油坊巷、夫子庙、秦淮河,," 甘松筠在长乐街（今长乐路)茶馆内说讲《大陆新闻》，大谈“大后方”、抗战以及英美等国际形势和抗战胜利的消息，日日满座，轰动全城。
       南京成为沦陷区后，甘松筠在长乐街（今长乐路)靠近新桥的万全茶馆内说讲《大陆新闻》，大谈“大后方”、抗战以及英美等国际形势和抗战胜利的消息，为此曾遭日本宪兵的逮捕，疑其为国民党特务，而用刑逼供。甘坚不承认，日方因无确实证据，只得将其释放。甘养好伤后，因无其他谋生之路，遂仍在万全茶馆说讲新闻。抗日战争胜利后，国民党发动内战，甘乃继续在门西仓顶李氏茶馆及长乐街万全茶馆说“报”，日日满座，轰动全城，就连张文伯主编的国民党中央日报月刊杂志也曾撰文为甘宣扬，称之为“江南怪杰甘松筠”。——《南京文化志上册》"
953,齐云观,齊雲觀,,寺观/祠庙,宗教,古台城内,宋代,宋代,118.7706,32.0652,,,,,"宋代许多文人墨客登临齐云观。
《齐云观》（节选）
马之纯
高高真是与云齐，直到青霄不用梯。
三阁连延须在下，层城突兀亦居低。
俯看落雨自天半，平视流星从屋西。"
2806,洪武路,洪武路,,道路,城市与建筑,依据《1930年代南京市实测新图》定位,近代,近代,118.7822,32.0401,,,虹桥、户部街、卢妃巷、淮海路、南唐宫、中山,,1937年，我还是个12岁的少年。一家人住在洪武路一带靠近政府机关的相府营。家里有七十多岁的瞎子祖母、叔叔赵庭魁、母亲和继父潘东发，还有不满一个月的弟弟。祖母是个封建保守的人，说宁死也不愿离开家，所以日军进攻南京时，我们一家没有离开家。那条街上没有避难的只有我家，别的人要么搬走了，要么去难民区避难了。——《南京战》
1526,太平街,太平街,,道路,愿景,依据《陆师学堂新测金陵省全图》，补充1874年《上江两县志》、1908年《金陵杂志》定位,清朝,清朝,118.7687,32.0235,,,,,"清代，王孝煃归金陵曾居住在太平街。
父死后，不愿就仕途，奉母归金陵。初住门西太平街，后迁朱状元巷。——《随园食单》"
73,征虏亭,征虜亭,,码头/驿站,政治军事,鼓楼区西南明城墙内,六朝,六朝,118.7515,32.0545,,,,,"东吴旧亭，东晋重修，当时“京师三亭”之一，重要的军事驿站。
东昏侯在东宫，议欲叛，使人上屋望，见征虏亭失火，〔七四〕谓敬则至，急装欲走。——许嵩《建康实录》"
3079,颐和路,頤和路,,道路,愿景,依据《1930年代南京市实测新图》定位,近代,近代,118.7615,32.0652,,,鼓楼、宁海路,,"颐和路因为在安全区的缘故，有许多洋楼公馆在今天被列为文物保护单位，使其成为最有特色的民国建筑群。
        安全区位于南京城的西北角，是南京城内环境最幽雅的地区。金陵女子文理学院（今南京师范大学）、金陵大学（今南京大学）、鼓楼医院等近代优秀建筑得以幸免大火，宁海路、颐和路一带几百幢私人小洋楼得以保留下来，也完全是因为在安全区的缘故。其中有许多在今天被列为文物保护单位，宁海路、颐和路一带成为最有特色的民国建筑群。作为历史文化遗产，其价值是无法用金钱估量的。——《南京大屠杀的见证人拉贝传》"
739,延兴寺,延興寺,,寺观/祠庙,愿景,红土桥附近，运渎西,六朝,六朝,118.7728,32.0306,,,,,"东晋后宫沉迷佛法，喜好建造各种寺庙。
后妃公主之造寺塔自东晋偏安江左，后妃公主，皆溺情内典，塔寺日盛。如晋康帝褚皇后建延兴寺。——《金陵古迹图考》"
1822,致和街,致和街,,道路,愿景,依据《陆师学堂新测金陵省全图》，补充1874年《上江两县志》、1908年《金陵杂志》定位,清朝,清朝,118.7877,32.0271,,,,,致和街在务公街西，旧清平桥街。——《南京南京》
589,钟山书院,鐘山書院,,学校,山川,依据《陆师学堂新测金陵省全图》，补充1874年《上江两县志》、1908年《金陵杂志》定位,清朝,清朝,118.7859,32.0344,,姚鼐、钱大昕,青溪、升平桥、白下,伯沆怒掷案上镫,"钟山书院有清一代，南京钟山书院历史最久，影响也最大。
据《江宁府志》记载：“钟山书院，在府城内旧钱厂地。雍正二年（1724）总督查弼纳创建”。光绪二十九年（1903），钟山书院改为江南高等学堂，延续近两百年的钟山书院到此不复存在。——《南京文化志下册》"
2348,糖坊桥,糖坊橋,,桥梁,物产与经济,依据《陆师学堂新测金陵省全图》，补充1874年《上江两县志》、1908年《金陵杂志》定位,清朝,清朝,118.78,32.046,,,估衣廊、北门桥,,"糖坊桥因靠糖坊和小桥得名。
传清康熙间，名炳熙村。后成街巷，因靠糖坊和小桥，名糖坊桥，街以桥名。——网络检索"
3562,狮山,獅山,,山脉,动植物,依据《1930年代南京市实测新图》定位,近代,近代,118.7423,32.0965,,,,,删除内容
1835,小石坝街,小石壩街,,道路,景观描述,依据《陆师学堂新测金陵省全图》，补充1874年《上江两县志》、1908年《金陵杂志》定位,清朝,清朝,118.787,32.022,,,白鹭洲、金陵、大石坝街、金陵闸、乌衣巷,,"小石坝街位于白鹭洲公园西侧，清代有记载。
清《同治上江两县志》载有此巷，因毗邻大石坝街而得名。原街长251米，宽2.8米。——《十里秦淮桥道志》"
2792,汉口路,漢口路,,道路,城市与建筑,依据《1930年代南京市实测新图》定位,近代,近代,118.7761,32.0557,,,金陵、金陵大学、上海路、中山、中山路、仓巷、汉中路、平仓、平仓巷、中路、鼓楼,,1937年12月18日至1938年1月11日之间，日本兵到我汉口路21号的住宅来了10次，或11次，他们偷窃、毁坏我下列的个人财产。从12月1日到3月1日，我平均每周回去察看3到6次。常常回去察看的情况显示，到12月18日，住宅内的财物情况良好。12月1日以来，房屋没有受到任何破坏。——《忍辱负重的使命美国外交官记载的南京大屠杀与劫后的社会状况》
3314,梅园,梅園,,居民区,动植物,依据《1930年代南京市实测新图》定位,近代,近代,118.7965,32.0449,,太平,,,"抗战胜利后，中共代表团南京办事处设在梅园新村。
抗日战争取得最后胜利后，国民政府宣布还都南京。国共两党谈判中心也由重庆转移到南京。1946年5月3日，中国共产党首席代表周恩来率领邓颖超、陆定一和廖承志等一行乘专机来到南京，住在梅园新村。——《名人与南京》"
1979,侍其巷,待其巷,,道路,人物姓氏,依据《陆师学堂新测金陵省全图》，补充1874年《上江两县志》、1908年《金陵杂志》定位,清朝,清朝,118.7732,32.0188,,,,,
522,海陵王墓,海陵王墓,,古迹,,据《上江两县志》，今址暂不可考,清朝,清朝,,,,,,,"清代，海陵王墓位置尚未确定。
墓志石在江宁，未必其墓即在江宁，如今墓志石转辗流传入于大都会者甚多，不能即据墓志流传之地，即定为其墓即在是也。——《江宁金石记》"
2662,兴中门,興中門,,城门,愿景,依据《1930年代南京市实测新图》定位,近代,近代,118.7424,32.0937,,太平,仪凤门、挹江门、中华门、通济门、狮子山、新民门、中山、中山门、鼓楼、太平门、定淮门、光华门、和平门、金川门、玄武、玄武门、京城、静海寺、水西门、中央门、钟阜门,,"近代时，兴中门有水师学堂
水师学堂在仪凤门（今兴中门）与孙中山逝世后开通的挹江门之间。鲁迅回忆说：“一进仪凤门，便可以看见它那20丈高的桅杆和不知多高的烟囱。”“可爱的是桅杆”“人如果爬到顶，便可以近看狮子山，远眺莫愁湖”。——《名人与南京》"
1118,玉泉山,玉泉山,,山脉,溧水南,山川,元代,元代,118.9605,31.271,,,,,"元代刘鹗曾游玉泉山并题诗多首
《玉泉山二首其一》
刘鹗
杨柳芙蕖接断岑，流泉如玉本源深。
四时潋滟无晴暖，一派清泠有古今。
石井分甘供御膳，湖波流润洗尘心。
我来正值秋将晚，独坐长吟雪满襟。"
2454,石龙池,石龍池,,山脉,城市与建筑,方山风景区内,清朝,清朝,118.8701,31.8968,,,,,"因澄澈而闻名。
有石龙池，澄泓可爱，清鉴毛发，织鳞游泳。或云龙族西迤十里为虎肱洞，有巨石若囷若盘，复有石丈人春秋报赛于此。《一统志》：有泉石之胜。——《金陵胜迹志》"
1621,丁家桥,丁家橋,,桥梁,交通,依据《陆师学堂新测金陵省全图》，补充1874年《上江两县志》、1908年《金陵杂志》定位,清朝,清朝,118.7723,32.0729,,,牌楼、三牌楼、中央党部、夫子庙、中正街,,"此地是南洋劝业会浙江会馆的所在。
1909年6月，鲁迅从日本归国，先在杭州，1910年8月回到故乡，任绍兴府中学堂监学兼博物教员。注重实践的鲁迅，听说南洋劝业会在南京开幕，就建议将秋季远足改为赴南京参观，以扩大学生眼界，增长实际知识。不久，鲁迅率府中200多师生乘船离绍兴，经苏州乘火车抵达南京下关车站。天色虽晚，但用灯泡组成的“南洋劝业会”五个耀眼大字使师生倍感兴奋。鲁迅带队步行至丁家桥浙江会馆住宿，第二天就开始参观。——《名人与南京》"
1584,堂子巷,堂子巷,,道路,物产与经济,依据《陆师学堂新测金陵省全图》，补充1874年《上江两县志》、1908年《金陵杂志》定位,清朝,清朝,118.7839,32.02,,,船板巷,,"清代，状元秦大士居于堂子巷。
《东城志略》：武定桥东，为堂子巷……秦殿撰大士[秦大士（1715-1777)，字鲁一、鉴泉，号涧泉、秋田老人，江宁（今江苏南京）人。乾隆十七年（1752)壬申恩科殿试一甲第1名（状元），授翰林院修撰。历任顺天乡试同考官、翰林院侍讲学士、福建乡试主考官、会试同考官等。能诗文，善书画，著有《抹云楼集》等。]归老后居之。——《十里秦淮桥道志》"
971,甄邯墓,甄邯墓,,陵墓,人物姓氏,玄武湖附近,宋代,宋代,118.7874,32.0877,,,,,
2388,大石桥,大石橋,,桥梁,景观描述,依据《陆师学堂新测金陵省全图》，补充1874年《上江两县志》、1908年《金陵杂志》定位,清朝,清朝,118.7853,32.0558,,,,,"藏书家吴梅私人藏书处在大石桥附近。
百嘉室近代戏曲学家、教育家、藏书家吴梅的私人藏书处。地址在南京城中大石桥22号。——《南京文化志下册》"
2095,彩霞街,彩霞街,,道路,景观描述,依据《陆师学堂新测金陵省全图》，补充1874年《上江两县志》、1908年《金陵杂志》定位,清朝,清朝,118.7737,32.0261,,,升州路、浮桥、上浮桥、秦淮、玉带巷、颜料坊、鸡鹅巷,,"美食各具特色，种类繁多，商品文化兴盛。
其地原为集市，每天挤满卖鸡鸭鱼肉果蔬的农民。农民大都脚着草鞋，街名由此而来。后来渐渐有名，商人纷至沓来，鳞次开店，满街飘舞五颜六色的店幌，如彩霞一般，遂有“彩霞街”之称。——百度百科"
810,状元坊,狀元坊,,道路,人物姓氏,秦淮区中华广场一带,宋代,宋代,118.781,32.0291,,,,,"宋代，状元坊内多文庙、府学、贡院登文化机构
宋代，文庙、府学、贡院，先后建于街北，地属状元坊。——《十里秦淮桥道志》"
1564,碑亭巷,碑亭巷,,道路,城市与建筑,依据《陆师学堂新测金陵省全图》，补充1874年《上江两县志》、1908年《金陵杂志》定位,清朝,清朝,118.7883,32.0448,,,,,"因有清初赞颂亲王功德的碑而得名。
据《炳烛里谈》记载：“国初豫亲王下江南，兵不血刃，民感其惠，立碑以颂德。今城北之碑亭巷是也。”《钟南淮北区域志》亦载：“清豫亲王初下江南，秋毫无犯，城人立碑于巷，以颂功德，用亭覆之。”——《南京地名源》"
3116,珠江路,珠江路,,道路,山川,依据《1930年代南京市实测新图》定位,近代,近代,118.7805,32.0521,,太平,北门桥、估衣廊、水西门、中华门、台城、中山、大中桥、广州路、建康、白下、白下路、浮桥、长江、中山路、竺桥、莲花桥、太平桥、珍珠桥,,珠江路位于新街口和鼓楼之间，东起解放路，西至中山路，以我国四大河流之一的珠江命名。珠江路紧靠杨吴城濠并与之平行，此濠为南唐都城北限，南朝皇家宫苑南限。——《南京地名源》
83,东安寺,東安寺,,寺观/祠庙,愿景,据《建康实录》，今址暂不可考,六朝,六朝,,,,,,,"南朝宋都佛徒辩经讲禅的地方。
又有慧严、慧议道人，并住东安寺。——《南史》"
1292,上方桥,上方橋,,桥梁,方位与位置,七桥瓮,明代,明代,118.8076,32.0161,,,,,
494,老虎头,老虎頭,,道路,史实传说与作品,依据《陆师学堂新测金陵省全图》，补充1874年《上江两县志》、1909年《金陵杂志》定位,清朝,清朝,118.7866,32.0123,,,娄湖、石观音,周处杀虎,"老虎头得名于东吴娄侯张昭，张昭在此地修建娄湖，故称娄湖头，后谐音传为老虎头。
《东城志略》载：“娄湖者，吴张娄侯所开也俗呼.........老虎头者，娄湖头之转音也。”《秣陵集》也说，娄湖苑是孙吴辅吴将军张昭旧居。——《金陵琐志九种上》"
834,广济坊,廣濟坊,,道路,愿景,秦淮区南京市五中一带,宋代,宋代,118.7768,32.0346,,,,,
2249,花市,花市,,道路,动植物,依据《陆师学堂新测金陵省全图》，补充1874年《上江两县志》、1908年《金陵杂志》定位,清朝,清朝,118.7787,32.0208,,,三山、三山街、大功坊、金陵、南门、南门大街,,"古时专营造花之地。
《景定建康志》载：顾恺之家在府治右南厢中界花行街。宋时名层楼街，当即今三山街之花市也。——《南京地名源》"
1655,水西门大街,水西門大街,,道路,城市与建筑,依据《陆师学堂新测金陵省全图》，补充1874年《上江两县志》、1908年《金陵杂志》定位,清朝,清朝,118.768,32.0318,,,,,《运渎桥道小志》载：自评事街南口（即古果子街口）向西，至斗门桥（即陡门桥）为讲堂大街；斗门桥向西至仓巷口为油市大街；再向西为水西门大街。——《南京地名源》
2599,织造署,織造署,,衙署,政治军事,依据《陆师学堂新测金陵省全图》，补充1874年《上江两县志》、1908年《金陵杂志》定位,清朝,清朝,118.7899,32.0265,,江总,行宫、大行宫,,康熙十三年（1674年）改为织造衙门，亦称织造府或织造署，由内务府派郎官掌管，并将总织局迁至衙门以北。清朝康熙皇帝六下江南，有五次就住在江宁织造府内，而四次都是曹雪芹的爷爷曹寅接的驾。故亦称“大行宫”——百度百科
1570,张府园,張府園,,居民区,人物姓氏,依据《陆师学堂新测金陵省全图》，补充1874年《上江两县志》、1908年《金陵杂志》定位,清朝,清朝,118.777,32.0337,,,白下、羊市桥、大香炉、明瓦廊、木料市、内桥,,清代甘熙《白下琐言》卷一载：“南唐护龙河自升平桥经上元县之左东边一带水道，各志历历言之，而西者独略。今羊市桥畔，上踞屋舍，下穿沟渠，后为张府园裕民坊。——《南京城墙志》
964,晋穆帝陵,晉穆帝陵,,陵墓,人物姓氏,幕府山南麓,宋代,宋代,118.785,32.1195,,,,,晋穆帝司马聃，字彭子，东晋第五代国君，晋康帝司马岳之子，母褚蒜子。344年司马岳死，司马聃即位；由于年幼而由母太后褚蒜子掌政，并由何充辅政。何充过世后改由蔡谟与司马昱辅政。司马聃在位期间东晋虽然北伐失败，但是由于桓温消灭了在四川立国成汉，并且于356年夺回洛阳，虽然不久就因为粮运不继而撤退，但东晋的版图仍然有所扩大。361年司马聃死去，终年十九岁。——搜狗百科
718,淮青桥,淮青橋,青溪大桥，淮清桥,桥梁,方位与位置,桃叶渡附近,六朝,六朝,118.7887,32.0254,,,青溪、秦淮、淮水、四象桥、利涉桥、内桥、建康、斗门桥、金陵、秦淮河、钟山,,"六朝时，淮青桥（即清溪大桥）与其他六座桥和清溪组成金陵四十八景之一的七桥九曲
古青溪阔五丈，深八尺，自三国孙吴之后，陆续在其上建了七座大桥，分别是东门桥、尹桥、鸡鸣桥、募士桥、菰首桥、青溪中桥、青溪大桥。——《南京明清建筑》
七桥（东门桥、尹桥、鸡鸣桥、募士桥、菰首桥、青溪中桥、青溪大桥）九曲，是金陵四十八景之一。——《南京地名趣话》"
2940,上海路,上海路,,道路,城市与建筑,依据《1930年代南京市实测新图》定位,近代,近代,118.7714,32.0521,,,中山、中山路、汉中路、中路、新街口、汉口路、金陵、宁海路、西康路、广州路、山西路、五台山、中山北路,,"12月23日下午约5时，两个日本兵来到位于上海路2号、属于美国机构金陵神学院的一座住宅，要强行占用这座住宅大院。日本兵在强占时拳打脚踢金陵神学院的美国教师胡勃特•拉法耶特•索尼（HubertLafayetteSone）。
——《忍辱负重的使命美国外交官记载的南京大屠杀与劫后的社会状况》"
1838,三条营,三條營,,道路,方位与位置,依据《陆师学堂新测金陵省全图》，补充1874年《上江两县志》、1908年《金陵杂志》定位,清朝,清朝,118.781,32.0134,,,,,"清代，三条营住有达官贵人，例如富商蒋寿山。
蒋寿山又名蒋士权，回族，是晚清南京的富商，他在南京有多处房地产，一处是城南门东的三条营18、20号。此处为南京民居典型的多进穿堂庭院式建筑群。——《南京明清建筑》"
1569,明瓦廊,明瓦廊,,道路,物产与经济,依据《陆师学堂新测金陵省全图》，补充1874年《上江两县志》、1908年《金陵杂志》定位,清朝,清朝,118.7781,32.0386,,,大香炉、裱画廊、估衣廊、木料市、内桥、张府园,,"清代的明瓦廊与南京逝去的生产民俗相关，包含工商风俗的信息
南京市区中的一些街巷名称也留有生产民俗的文化印痕，例如，铜作坊、铁作坊、锦绣坊、弓箭坊、颜料坊、箍桶巷、剪子巷、绒装街、估衣廊、裱画廊、明瓦廊、火瓦巷等，都与南京逝去的生产民俗相关，留下追寻工商风俗的信息。——《南京民俗》"
1516,常府街,常府街,,道路,人物姓氏,依据《陆师学堂新测金陵省全图》，补充1874年《上江两县志》、1908年《金陵杂志》定位,清朝,清朝,118.7903,32.0358,,太平、金陵刻经处,花牌楼、牌楼、北极阁、金陵,,"清代，杨仁山居士将金陵刻经处迁于常府街。
金陵刻经处初设于北极阁，继迁至杨仁山位于常府街的家中，后又转迁至花牌楼（今太平路）一带。——《南京寺庙史话》"
2769,高楼门,高樓門,,道路,政治军事,依据《1930年代南京市实测新图》定位,近代,近代,118.7817,32.0633,,,,,这是个外号叫“袁大个”的小伙子，他叫袁存荣，长得人高马大，手下有一帮小兄弟。他原来住在高楼门，日军开始攻打南京，就住到宁海路19号朋友家，在安全委员会做杂工。前段时间他带了一帮人插小旗子，砌炉灶，干得十分卖力。——《南京大屠杀的见证人拉贝传》
1539,莲花桥,蓮花橋,,桥梁,动植物,依据《陆师学堂新测金陵省全图》，补充1874年《上江两县志》、1908年《金陵杂志》定位,清朝,清朝,118.7842,32.0519,,,进香河、北门桥、仓桥、西仓桥、严家、严家桥、板桥、浮桥、红板桥、石桥、珠江路,,"清代理学名臣熊赐履曾客居莲花桥。
下学堂清初熊赐履藏书处，位于江宁青溪之莲花桥（今南京玄武区莲花桥）。——《南京文化志下册》"
